{
  "id": "premium-cinematic-landscape",
  "version": "1.0.0",
  "orientation": "landscape",
  "print": {
    "widthIn": 24,
    "heightIn": 18,
    "dpi": 300,
    "bleedIn": 0.125,
    "safeMarginIn": 0.25,
    "colorMode": "CMYK",
    "formats": ["pdf", "jpg"]
  },
  "canvas": { "aspect": 1.3333, "referencePx": [7200, 5400] },
  "composition": {
    "hero": { "cx": 0.30, "cy": 0.52, "w": 0.34, "h": 0.72, "anchor": "bottom" },
    "name": { "cx": 0.30, "baseline": 0.70, "maxWidthFrac": 0.40 },
    "slots": [
      { "id": "s1", "cx": 0.66, "cy": 0.30, "w": 0.26, "h": 0.30, "importance": "primary" },
      { "id": "s2", "cx": 0.86, "cy": 0.34, "w": 0.20, "h": 0.24, "importance": "secondary" },
      { "id": "s3", "cx": 0.64, "cy": 0.62, "w": 0.22, "h": 0.26, "importance": "secondary" },
      { "id": "s4", "cx": 0.85, "cy": 0.64, "w": 0.18, "h": 0.22, "importance": "tertiary" }
    ],
    "footer": { "cy": 0.93, "iconCount": 5 }
  },
  "lighting": {
    "spotlight": { "on": true, "warmth": "gold", "intensity": 0.22 },
    "rimLight": { "passes": 2, "softBlurFrac": 0.05 },
    "grounding": { "contactShadow": true, "castShadow": true },
    "importanceModel": "large slots get top-light + gold keyline; small slots get dark veil + edge occlusion"
  },
  "palette": {
    "roles": ["primary", "secondary", "accent", "ink", "paper"],
    "rules": { "contrastFloor": 4.5, "cmykSafe": true, "goldAccent": "#C9A84C" }
  },
  "atmosphere": {
    "haze": true,
    "goldBloom": true,
    "lightRays": "subtle",
    "particles": [{ "count": 46, "tone": "gold", "blend": "lighter" }],
    "vignette": 0.78
  },
  "typography": {
    "display": "Cormorant Garamond",
    "ui": "Outfit",
    "nameScrim": true,
    "nameShadow": { "alpha": 0.78 }
  },
  "styleConstitution": "cinematic, editorial, luxury keepsake; refined not busy; emotion first; gallery-worthy",
  "compositionContract": "single clear hero; supporting memories in an ordered collage; generous negative space; balanced gold accents; clear visual hierarchy",
  "printContract": "24x18in @ 300dpi, 0.125in bleed, 0.25in safe margin, CMYK-safe palette, no critical content in the bleed, PDF + JPG"
}
